{
  "$schema": "http://json-schema.org/draft-07/schema#",
  "title": "StyleConstraint",
  "description": "Ограничение стиля: правило вида 'feature >= threshold' или 'feature <= threshold'",
  "type": "object",
  "required": [
    "id",
    "styleId",
    "feature",
    "operator",
    "threshold",
    "weight"
  ],
  "properties": {
    "id": {
      "type": "string",
      "description": "Уникальный идентификатор ограничения",
      "pattern": "^[a-z0-9-]+$"
    },
    "styleId": {
      "type": "string",
      "description": "Ссылка на стиль, к которому применяется ограничение"
    },
    "feature": {
      "type": "string",
      "enum": [
        "wood_share",
        "metal_share",
        "glass_share",
        "plastic_share",
        "fabric_share",
        "color_temperature",
        "saturation",
        "form_complexity"
      ],
      "description": "Признак, к которому применяется ограничение"
    },
    "operator": {
      "type": "string",
      "enum": [">=", "<="],
      "description": "Оператор сравнения: >= (минимум) или <= (максимум)"
    },
    "threshold": {
      "type": "number",
      "minimum": 0,
      "maximum": 1,
      "description": "Пороговое значение"
    },
    "weight": {
      "type": "number",
      "minimum": 0,
      "exclusiveMinimum": true,
      "description": "Вес ограничения при расчете штрафа (важность правила)"
    },
    "messageKey": {
      "type": "string",
      "description": "Ключ сообщения обратной связи для игрока при нарушении"
    }
  },
  "additionalProperties": false
}
