[
  {
    "id": "scand-wood-min",
    "styleId": "scandinavian",
    "feature": "wood_share",
    "operator": ">=",
    "threshold": 0.5,
    "weight": 2.0,
    "messageKey": "scand-wood-low"
  },
  {
    "id": "scand-form-simple",
    "styleId": "scandinavian",
    "feature": "form_complexity",
    "operator": "<=",
    "threshold": 0.4,
    "weight": 1.5,
    "messageKey": "scand-form-complex"
  },
  {
    "id": "scand-saturation-low",
    "styleId": "scandinavian",
    "feature": "saturation",
    "operator": "<=",
    "threshold": 0.5,
    "weight": 1.0,
    "messageKey": "scand-saturation-high"
  },
  {
    "id": "scand-plastic-free",
    "styleId": "scandinavian",
    "feature": "plastic_share",
    "operator": "<=",
    "threshold": 0.1,
    "weight": 1.5,
    "messageKey": "scand-plastic-high"
  },
  {
    "id": "scand-warm-tone",
    "styleId": "scandinavian",
    "feature": "color_temperature",
    "operator": ">=",
    "threshold": 0.5,
    "weight": 1.0,
    "messageKey": "scand-color-cold"
  }
]
